{"actual_url":"https://arxiv.org/html/2604.19495v2","analysis_id":"EXOT-2024-32","arxiv_version":"2604.19495v2","byte_count":1102716,"collaboration":"ATLAS","doi":"10.1016/j.physletb.2026.140849","hepdata_record_id":null,"hepdata_version":null,"historical_evidence":{"locator":"arXiv submission history v2; current version v2","sha256":"cc326dee5fb4ab5e296dd5db6d87fba0eb66fdfecb887279a84b3ce5eb367de5","source_id":"atlas_metadata","source_version":"retrieved-cc326dee5fb4ab5e"},"inspire_id":null,"journal_ref":"Phys.Lett.B881(2026)140849","media_type":"text/html","publication_date_precision":"DAY","published_at":"2026-09-24","purpose":"RESEARCH","retrieved_at":"2026-10-18T10:19:44.406706+00:00","schema_version":"1.0.0","sha256":"6871595fe1a737fb5cdcc57f322626d870b24a7afc3060feb3ec4a9186c10444","source_id":"atlas_paper_v2","source_relationships":[{"locator":"arXiv submission history v2; current version v2","sha256":"cc326dee5fb4ab5e296dd5db6d87fba0eb66fdfecb887279a84b3ce5eb367de5","source_id":"atlas_metadata","source_version":"retrieved-cc326dee5fb4ab5e"}],"source_version":"2604.19495v2","table_ids":["S6.T2"],"title":"EXOT-2024-32 atlas_paper_v2","url":"https://arxiv.org/html/2604.19495v2"}