{"actual_url":"https://arxiv.org/abs/2604.10732","analysis_id":"EXO-24-028","arxiv_version":null,"byte_count":44461,"collaboration":"CMS","doi":null,"hepdata_record_id":null,"hepdata_version":null,"historical_evidence":null,"inspire_id":null,"journal_ref":null,"media_type":"text/html","publication_date_precision":"UNKNOWN","published_at":null,"purpose":"RESEARCH","retrieved_at":"2026-10-18T10:19:44.405708+00:00","schema_version":"1.0.0","sha256":"5195ba7b7c7dd2e26c982ade7efa03b228fe2b7746f91b0bc09c3bc2d8ec170b","source_id":"cms_metadata","source_relationships":[],"source_version":"retrieved-5195ba7b7c7dd2e2","table_ids":[],"title":"EXO-24-028 cms_metadata","url":"https://arxiv.org/abs/2604.10732"}