{"actual_url":"https://cms-results.web.cern.ch/cms-results/public-results/publications/EXO-24-028/","analysis_id":"EXO-24-028","arxiv_version":null,"byte_count":112715,"collaboration":"CMS","doi":null,"hepdata_record_id":null,"hepdata_version":null,"historical_evidence":null,"inspire_id":null,"journal_ref":null,"media_type":"text/html","publication_date_precision":"UNKNOWN","published_at":null,"purpose":"RESEARCH","retrieved_at":"2026-10-18T10:19:44.853452+00:00","schema_version":"1.0.0","sha256":"5a8380ff28ca7ee4f84f0256dfb73d75cd87d6e141e164973794c2bff9a5b989","source_id":"cms_aux","source_relationships":[],"source_version":"retrieved-5a8380ff28ca7ee4","table_ids":[],"title":"EXO-24-028 cms_aux","url":"https://cms-results.web.cern.ch/cms-results/public-results/publications/EXO-24-028/"}