{"actual_url":"https://atlas.web.cern.ch/Atlas/GROUPS/PHYSICS/PAPERS/EXOT-2024-32/","analysis_id":"EXOT-2024-32","arxiv_version":null,"byte_count":53500,"collaboration":"ATLAS","doi":null,"hepdata_record_id":null,"hepdata_version":null,"historical_evidence":null,"inspire_id":null,"journal_ref":null,"media_type":"text/html","publication_date_precision":"UNKNOWN","published_at":null,"purpose":"RESEARCH","retrieved_at":"2026-10-18T10:19:44.756814+00:00","schema_version":"1.0.0","sha256":"9dc1ffd1d0115bec9e3a14da3b014189278757319f8f4c144c74f9cf06c59f53","source_id":"atlas_aux","source_relationships":[],"source_version":"retrieved-9dc1ffd1d0115bec","table_ids":[],"title":"EXOT-2024-32 atlas_aux","url":"https://atlas.web.cern.ch/Atlas/GROUPS/PHYSICS/PAPERS/EXOT-2024-32/"}