{"actual_url":"https://arxiv.org/abs/2604.19495","analysis_id":"EXOT-2024-32","arxiv_version":null,"byte_count":43122,"collaboration":"ATLAS","doi":null,"hepdata_record_id":null,"hepdata_version":null,"historical_evidence":null,"inspire_id":null,"journal_ref":null,"media_type":"text/html","publication_date_precision":"UNKNOWN","published_at":null,"purpose":"RESEARCH","retrieved_at":"2026-10-18T10:19:44.405708+00:00","schema_version":"1.0.0","sha256":"cc326dee5fb4ab5e296dd5db6d87fba0eb66fdfecb887279a84b3ce5eb367de5","source_id":"atlas_metadata","source_relationships":[],"source_version":"retrieved-cc326dee5fb4ab5e","table_ids":[],"title":"EXOT-2024-32 atlas_metadata","url":"https://arxiv.org/abs/2604.19495"}