{"actual_url":"https://arxiv.org/html/2604.10732v2","analysis_id":"EXO-24-028","arxiv_version":"2604.10732v2","byte_count":701022,"collaboration":"CMS","doi":"10.1007/JHEP08(2026)098","hepdata_record_id":null,"hepdata_version":null,"historical_evidence":{"locator":"arXiv submission history v2; current version v2","sha256":"5195ba7b7c7dd2e26c982ade7efa03b228fe2b7746f91b0bc09c3bc2d8ec170b","source_id":"cms_metadata","source_version":"retrieved-5195ba7b7c7dd2e2"},"inspire_id":null,"journal_ref":"JHEP08(2026)098","media_type":"text/html","publication_date_precision":"DAY","published_at":"2026-08-26","purpose":"RESEARCH","retrieved_at":"2026-10-18T10:19:44.690289+00:00","schema_version":"1.0.0","sha256":"7fadcfce5fce60055ccd817d98d05c9d09e4c759f1691022a0d3f4f7cf2be955","source_id":"cms_paper_v2","source_relationships":[{"locator":"arXiv submission history v2; current version v2","sha256":"5195ba7b7c7dd2e26c982ade7efa03b228fe2b7746f91b0bc09c3bc2d8ec170b","source_id":"cms_metadata","source_version":"retrieved-5195ba7b7c7dd2e2"}],"source_version":"2604.10732v2","table_ids":["Ch0.S9.SS2.tab1"],"title":"EXO-24-028 cms_paper_v2","url":"https://arxiv.org/html/2604.10732v2"}